{
  "$schema": "https://agent-orchestrator.dev/quality/schemas/quality-run-report.v1.schema.json",
  "schemaVersion": 1,
  "run": {
    "id": "review-63470b6821df4d8eba9716ed976fbf6f",
    "revision": 1,
    "repositoryId": "default",
    "repositoryName": "quality-studio",
    "kind": "code",
    "scopeUnitId": "qs-v1/dotnet/file/9b984bea83dbe8518387fcc1252a278cdab352654b348ff0c63e62a6a856a155",
    "level": "file",
    "path": "src/QualityStudio.Api/RepositoryRegistry.cs",
    "state": "done",
    "completeness": "partial",
    "createdAt": "2026-09-01T07:37:25.4910038+00:00",
    "startedAt": "2026-09-01T07:37:25.686011+00:00",
    "finishedAt": "2026-09-01T07:40:25.0046045+00:00",
    "model": "runner-default",
    "thinkingLevel": "model-default",
    "cliType": "codex",
    "force": true
  },
  "subject": {
    "manifestHash": "sha256:2f85effd37f6d8bcb6d26f0f66adac960a7a23456d99b38bee67093237827047",
    "targets": [
      {
        "unitId": "qs-v1/dotnet/file/9b984bea83dbe8518387fcc1252a278cdab352654b348ff0c63e62a6a856a155",
        "name": "RepositoryRegistry.cs",
        "path": "src/QualityStudio.Api/RepositoryRegistry.cs",
        "subjectHash": "sha256:b9867cf34976be380707fc1b454a6e9208e3ada7ff74e3f9abdf1cc07d37429d"
      }
    ]
  },
  "execution": {
    "reviewed": 0,
    "reusedFresh": 0,
    "failed": 1,
    "skipped": 0,
    "cancelled": 0,
    "aggregateOutcome": null,
    "errors": [
      "src/QualityStudio.Api/RepositoryRegistry.cs: Finding range is outside reviewed file \u0027src/QualityStudio.Api/RepositoryRegistry.cs\u0027."
    ],
    "usage": {
      "operations": 1,
      "inputTokens": 20620,
      "outputTokens": 5330,
      "cachedInputTokens": 11008,
      "reasoningOutputTokens": 4142,
      "durationMs": 168340,
      "cost": null,
      "currency": null,
      "priceStatus": "unknownModel",
      "inputEstimateDeviationPercent": 257.86,
      "outputEstimateDeviationPercent": 3525.85,
      "costEstimateDeviationPercent": null
    },
    "cap": {
      "tokenLimit": 80000,
      "costLimit": null,
      "outcome": "within-cap",
      "reason": null
    },
    "estimate": {
      "files": 1,
      "operations": 1,
      "inputTokens": 5762,
      "outputTokens": 147,
      "cost": null,
      "currency": null,
      "historySamples": 1,
      "method": "Input is actual rendered prompt characters / 4; output uses 1 recorded .quality/usage operation(s)."
    }
  },
  "observations": [
    {
      "unitId": "qs-v1/dotnet/file/9b984bea83dbe8518387fcc1252a278cdab352654b348ff0c63e62a6a856a155",
      "level": "file",
      "path": "src/QualityStudio.Api/RepositoryRegistry.cs",
      "outcome": "failed",
      "producedByRun": false,
      "sidecarPath": null,
      "sidecarSha256": null,
      "capturedAt": null,
      "reviewedHash": null,
      "providerRunId": null,
      "grade": null,
      "summary": null,
      "findings": []
    }
  ],
  "delta": {
    "status": "unavailable",
    "priorRunId": null,
    "reason": "Partial runs are not comparable.",
    "new": [],
    "persisting": [],
    "resolved": [],
    "stateChanged": []
  },
  "summary": {
    "score": null,
    "grade": null,
    "findings": {
      "total": 0,
      "bySeverity": {
        "critical": 0,
        "high": 0,
        "medium": 0,
        "low": 0,
        "info": 0
      },
      "byState": {
        "open": 0,
        "accepted": 0,
        "waived": 0,
        "false-positive": 0,
        "resolved": 0
      }
    },
    "highestSeverity": null,
    "partialReason": "1 unit(s) failed."
  }
}
